{
	"$schema": "./nabla-dsomm-assessment.schema.json",
	"schemaVersion": 1,
	"contract": "nabla.dsomm.repository-assessment/v1",
	"subject": {
		"kind": "repository",
		"repository": "AlbanAndrieu/nabla-site-alban",
		"defaultBranch": "master",
		"url": "https://github.com/AlbanAndrieu/nabla-site-alban"
	},
	"assessment": {
		"id": "nabla-site-alban",
		"assessedAt": "2026-10-05",
		"basisRevision": "83d0ab91482a47b8bad5fa62479b75444ecadc82",
		"method": "evidence-based-self-assessment",
		"reviewStatus": "self-assessed",
		"scope": "Repository implementation, delivery/runtime controls, governance evidence and AI-assisted SDLC. Missing claims are intentionally not assessed."
	},
	"model": {
		"project": "OWASP DevSecOps Maturity Model (DSOMM)",
		"version": "5.0.2",
		"sourceCommit": "a2c1b7e6c7cc22de0d478027d76fd8d02c41fd7a",
		"activityIdentity": "uuid"
	},
	"progressDefinition": {
		"not-implemented": 0,
		"started": 0.2,
		"partly-implemented": 0.5,
		"fully-implemented": 1
	},
	"aggregation": {
		"identity": "activityUuid",
		"excludeApplicability": [
			"not-applicable"
		],
		"missingClaim": "not-assessed",
		"modelCompatibility": "exact-source-commit",
		"recommendedPortfolioStrategy": "mean-of-applicable-repository-scores",
		"notes": "Consumers must preserve repository/evidence provenance and assessment coverage. Missing claims are not zero. Assessments from different DSOMM source commits must be normalized to an explicit target model before portfolio aggregation."
	},
	"evidence": [
		{
			"id": "agent-policy",
			"type": "policy",
			"visibility": "public",
			"title": "Repository agent policy and deterministic publication state machine",
			"path": "AGENTS.md",
			"description": "Versioned rules for coding agents, local-first quality, exact-SHA proof, review and protected publication."
		},
		{
			"id": "agent-quality-gate",
			"type": "test",
			"visibility": "public",
			"title": "Agent local-first quality gate",
			"path": "scripts/agent-quality-gate.sh",
			"description": "Deterministic local quality, remediation and publication contract used before agent changes are published."
		},
		{
			"id": "ci-quality-security",
			"type": "workflow",
			"visibility": "public",
			"title": "Quality and security CI",
			"path": ".github/workflows/ci.yml",
			"description": "Semgrep, quality, unit, type, build and preview-security orchestration on pull requests."
		},
		{
			"id": "ci-zap-preview",
			"type": "workflow",
			"visibility": "public",
			"title": "OWASP ZAP preview DAST",
			"path": ".github/workflows/zap-preview.yml",
			"description": "Blocking preview DAST workflow for deployed pull-request candidates."
		},
		{
			"id": "ci-production-dast",
			"type": "workflow",
			"visibility": "public",
			"title": "Production DAST",
			"path": ".github/workflows/production-dast.yml",
			"description": "Independent production OWASP ZAP validation."
		},
		{
			"id": "ci-production-smoke",
			"type": "workflow",
			"visibility": "public",
			"title": "Production smoke validation",
			"path": ".github/workflows/production-smoke.yml",
			"description": "Post-deployment HTTP and SEO smoke coverage for the production site."
		},
		{
			"id": "ci-docker",
			"type": "workflow",
			"visibility": "public",
			"title": "Container build and smoke workflow",
			"path": ".github/workflows/docker-build.yml",
			"description": "Builds the fallback container and validates it with a smoke test."
		},
		{
			"id": "ci-vercel-preview",
			"type": "workflow",
			"visibility": "public",
			"title": "Vercel Preview security checkpoint",
			"path": ".github/workflows/vercel-preview.yml",
			"description": "Coordinates exact-preview validation and publishes the preview security checkpoint."
		},
		{
			"id": "security-policy",
			"type": "policy",
			"visibility": "public",
			"title": "Repository security policy",
			"path": "SECURITY.md",
			"description": "Documents supply-chain controls, scanning layers, deployment boundaries and least-privilege expectations."
		},
		{
			"id": "precommit-security",
			"type": "test",
			"visibility": "public",
			"title": "Pre-commit preventive controls",
			"path": ".pre-commit-config.yaml",
			"description": "Preventive integrity, private-key, lint and security hooks used before publication."
		},
		{
			"id": "renovate-policy",
			"type": "policy",
			"visibility": "public",
			"title": "Renovate dependency policy",
			"path": "renovate.json",
			"description": "Versioned dependency update and vulnerability-remediation policy; live activation remains separately tracked."
		},
		{
			"id": "master-ruleset-contract",
			"type": "documentation",
			"visibility": "public",
			"title": "GitHub master ruleset contract",
			"path": "docs/github-master-ruleset.md",
			"description": "Versioned target branch protection contract and explicit record that the live ruleset was still missing at the last audit."
		},
		{
			"id": "quality-roadmap",
			"type": "documentation",
			"visibility": "public",
			"title": "Quality and security roadmap",
			"path": "docs/quality-roadmap.md",
			"description": "Canonical open work and delivered quality/security invariants."
		},
		{
			"id": "security-baseline-tests",
			"type": "test",
			"visibility": "public",
			"title": "Application security baseline tests",
			"path": "tests/security-baseline.spec.ts",
			"description": "Browser-level security assertions for the deployed application."
		},
		{
			"id": "dsomm-contract-tests",
			"type": "test",
			"visibility": "public",
			"title": "DSOMM model contract tests",
			"path": "unit-tests/dsommPageContract.test.ts",
			"description": "Fail-closed tests for the pinned DSOMM model, provenance and local explorer contract."
		},
		{
			"id": "otel-instrumentation",
			"type": "repository",
			"visibility": "public",
			"title": "Vercel OpenTelemetry instrumentation",
			"path": "instrumentation.ts",
			"description": "Registers nabla-site-alban as an OpenTelemetry service in the Vercel runtime."
		},
		{
			"id": "github-green-baseline",
			"type": "workflow",
			"visibility": "public",
			"title": "Exact-SHA green quality and security baseline",
			"url": "https://github.com/AlbanAndrieu/nabla-site-alban/actions/runs/37358912087",
			"description": "CI (Quality and Security) run for basis revision 83d0ab91482a47b8bad5fa62479b75444ecadc82."
		},
		{
			"id": "github-zap-green-baseline",
			"type": "workflow",
			"visibility": "public",
			"title": "Exact-SHA OWASP ZAP Preview evidence",
			"url": "https://github.com/AlbanAndrieu/nabla-site-alban/actions/runs/37359427558",
			"description": "Successful OWASP ZAP Preview status observed for the assessment basis revision."
		},
		{
			"id": "github-playwright-green-baseline",
			"type": "workflow",
			"visibility": "public",
			"title": "Exact-SHA Playwright Preview evidence",
			"url": "https://github.com/AlbanAndrieu/nabla-site-alban/actions/runs/37359288301",
			"description": "Successful Playwright Preview E2E status observed for the assessment basis revision."
		},
		{
			"id": "notion-devsecops-roadmap",
			"type": "notion",
			"visibility": "restricted",
			"title": "Nabla — Système opérationnel DevSecOps sur 90 jours",
			"url": "https://app.notion.com/p/3dcf375a7e5e81cbaac0e4635b0dde90",
			"description": "Governance, criticality, control architecture, risk-based gates, resilience and evidence-first operating model."
		},
		{
			"id": "notion-security-champions",
			"type": "notion",
			"visibility": "restricted",
			"title": "Security Champions & Security Belts",
			"url": "https://app.notion.com/p/3def375a7e5e81d690b6d4e1e9891da1",
			"description": "Security Champion role, progressive training, coaching, review and threat-model participation model."
		},
		{
			"id": "notion-agentic-ai-security",
			"type": "notion",
			"visibility": "restricted",
			"title": "Agentic AI & MCP - Security Framework",
			"url": "https://app.notion.com/p/ccaf375a7e5e8321a9ad8187a7b98dcb",
			"description": "Threat model and controls for agentic AI: least privilege, allowlisting, human approval, auditability, fail-closed behavior and sandboxing."
		}
	],
	"claims": [
		{
			"activityUuid": "f6f7737f-25a9-4317-8de2-09bf59f29b5b",
			"activityName": "Defined build process",
			"dimension": "Build and Deployment",
			"level": 1,
			"applicability": "applicable",
			"progress": "fully-implemented",
			"score": 1,
			"scope": "development-process",
			"confidence": "high",
			"rationale": "The repository defines deterministic build commands and enforces production builds in CI.",
			"evidenceRefs": [
				"ci-quality-security",
				"agent-quality-gate",
				"github-green-baseline"
			]
		},
		{
			"activityUuid": "a340f46b-6360-4cb8-847b-a0d3483d09d3",
			"activityName": "Building and testing of artifacts in virtualized environments",
			"dimension": "Build and Deployment",
			"level": 2,
			"applicability": "applicable",
			"progress": "fully-implemented",
			"score": 1,
			"scope": "development-process",
			"confidence": "high",
			"rationale": "Pull-request validation builds and tests artifacts on hosted runners and the fallback image in Docker.",
			"evidenceRefs": [
				"ci-quality-security",
				"ci-docker",
				"github-green-baseline"
			]
		},
		{
			"activityUuid": "f3c4971e-9f4d-4e59-8ed0-f0bdb6262477",
			"activityName": "Pinning of artifacts",
			"dimension": "Build and Deployment",
			"level": 2,
			"applicability": "applicable",
			"progress": "partly-implemented",
			"score": 0.5,
			"scope": "development-process",
			"confidence": "high",
			"rationale": "Security-critical GitHub Actions and the Semgrep image are pinned immutably, while not every runtime dependency is content-addressed.",
			"evidenceRefs": [
				"security-policy",
				"ci-quality-security"
			]
		},
		{
			"activityUuid": "2858ac12-0179-40d9-9acf-1b839c030473",
			"activityName": "SBOM of components",
			"dimension": "Build and Deployment",
			"level": 2,
			"applicability": "applicable",